{
  "id": "encounter-difficulty",
  "name": "Difficulte d'une rencontre de combat",
  "source": "srd",
  "categories": ["facile", "moyenne", "difficile", "mortelle"],
  "thresholds": [
    { "level": 1, "facile": 25, "moyenne": 50, "difficile": 75, "mortelle": 100 },
    { "level": 2, "facile": 50, "moyenne": 100, "difficile": 150, "mortelle": 200 },
    { "level": 3, "facile": 75, "moyenne": 150, "difficile": 225, "mortelle": 400 },
    { "level": 4, "facile": 125, "moyenne": 250, "difficile": 375, "mortelle": 500 },
    { "level": 5, "facile": 250, "moyenne": 500, "difficile": 750, "mortelle": 1100 },
    { "level": 6, "facile": 300, "moyenne": 600, "difficile": 900, "mortelle": 1400 },
    { "level": 7, "facile": 350, "moyenne": 750, "difficile": 1100, "mortelle": 1700 },
    { "level": 8, "facile": 450, "moyenne": 900, "difficile": 1400, "mortelle": 2100 },
    { "level": 9, "facile": 550, "moyenne": 1100, "difficile": 1600, "mortelle": 2400 },
    { "level": 10, "facile": 600, "moyenne": 1200, "difficile": 1900, "mortelle": 2800 },
    { "level": 11, "facile": 800, "moyenne": 1600, "difficile": 2400, "mortelle": 3600 },
    { "level": 12, "facile": 1000, "moyenne": 2000, "difficile": 3000, "mortelle": 4500 },
    { "level": 13, "facile": 1100, "moyenne": 2200, "difficile": 3400, "mortelle": 5100 },
    { "level": 14, "facile": 1250, "moyenne": 2500, "difficile": 3800, "mortelle": 5700 },
    { "level": 15, "facile": 1400, "moyenne": 2800, "difficile": 4300, "mortelle": 6400 },
    { "level": 16, "facile": 1600, "moyenne": 3200, "difficile": 4800, "mortelle": 7200 },
    { "level": 17, "facile": 2000, "moyenne": 3900, "difficile": 5900, "mortelle": 8800 },
    { "level": 18, "facile": 2100, "moyenne": 4200, "difficile": 6300, "mortelle": 9500 },
    { "level": 19, "facile": 2400, "moyenne": 4900, "difficile": 7300, "mortelle": 10900 },
    { "level": 20, "facile": 2800, "moyenne": 5700, "difficile": 8500, "mortelle": 12700 }
  ],
  "multipliers": [
    { "minMonsters": 1, "multiplier": 1.0 },
    { "minMonsters": 2, "multiplier": 1.5 },
    { "minMonsters": 3, "multiplier": 2.0 },
    { "minMonsters": 7, "multiplier": 2.5 },
    { "minMonsters": 11, "multiplier": 3.0 },
    { "minMonsters": 15, "multiplier": 4.0 }
  ],
  "smallPartyMultiplier": 5.0,
  "largePartyMultiplier": 0.5,
  "experienceByChallenge": [
    { "challengeRating": 0, "experience": 10 },
    { "challengeRating": 0.125, "experience": 25 },
    { "challengeRating": 0.25, "experience": 50 },
    { "challengeRating": 0.5, "experience": 100 },
    { "challengeRating": 1, "experience": 200 },
    { "challengeRating": 2, "experience": 450 },
    { "challengeRating": 3, "experience": 700 },
    { "challengeRating": 4, "experience": 1100 },
    { "challengeRating": 5, "experience": 1800 },
    { "challengeRating": 6, "experience": 2300 },
    { "challengeRating": 7, "experience": 2900 },
    { "challengeRating": 8, "experience": 3900 },
    { "challengeRating": 9, "experience": 5000 },
    { "challengeRating": 10, "experience": 5900 },
    { "challengeRating": 11, "experience": 7200 },
    { "challengeRating": 12, "experience": 8400 },
    { "challengeRating": 13, "experience": 10000 },
    { "challengeRating": 14, "experience": 11500 },
    { "challengeRating": 15, "experience": 13000 },
    { "challengeRating": 16, "experience": 15000 },
    { "challengeRating": 17, "experience": 18000 },
    { "challengeRating": 18, "experience": 20000 },
    { "challengeRating": 19, "experience": 22000 },
    { "challengeRating": 20, "experience": 25000 },
    { "challengeRating": 21, "experience": 33000 },
    { "challengeRating": 22, "experience": 41000 },
    { "challengeRating": 23, "experience": 50000 },
    { "challengeRating": 24, "experience": 62000 },
    { "challengeRating": 25, "experience": 75000 },
    { "challengeRating": 26, "experience": 90000 },
    { "challengeRating": 27, "experience": 105000 },
    { "challengeRating": 28, "experience": 120000 },
    { "challengeRating": 29, "experience": 135000 },
    { "challengeRating": 30, "experience": 155000 }
  ]
}
